{
  "baseline": {
    "digest": "sha256:744bc7391a1360ba6efdb05fc7f298327984bf5776710fc866044bb7902011c3",
    "revision": "a61dfb7183a84a638dd6c958247ef2500a33d083"
  },
  "comparisons": [
    {
      "baseline_median_ns": "12042959147/2",
      "change_percent": "-98.474",
      "current_median_ns": "183776231/2",
      "explanation": null,
      "mode": "cold",
      "scenario": "arcade-scale-analysis",
      "status": "within-limit"
    },
    {
      "baseline_median_ns": "12088215603/2",
      "change_percent": "-97.987",
      "current_median_ns": "121661561",
      "explanation": null,
      "mode": "incremental",
      "scenario": "arcade-scale-analysis",
      "status": "within-limit"
    },
    {
      "baseline_median_ns": "62183291/2",
      "change_percent": "-30.543",
      "current_median_ns": "43190823/2",
      "explanation": null,
      "mode": "warm",
      "scenario": "arcade-scale-analysis",
      "status": "within-limit"
    },
    {
      "baseline_median_ns": "7256247/2",
      "change_percent": "-6.000",
      "current_median_ns": "3410440",
      "explanation": null,
      "mode": "cold",
      "scenario": "four-provider-analysis",
      "status": "within-limit"
    },
    {
      "baseline_median_ns": "9492865/2",
      "change_percent": "-12.779",
      "current_median_ns": "8279801/2",
      "explanation": null,
      "mode": "incremental",
      "scenario": "four-provider-analysis",
      "status": "within-limit"
    },
    {
      "baseline_median_ns": "2435258",
      "change_percent": "-5.401",
      "current_median_ns": "2303732",
      "explanation": null,
      "mode": "warm",
      "scenario": "four-provider-analysis",
      "status": "within-limit"
    }
  ],
  "current": {
    "digest": "sha256:0ffad8666ee2a733b1cc6bbe1f690f9f6da721261776bf0c2560fdfc9b265e87",
    "revision": "eef2c82be0cc1328b92c11452f05cd7e8facda54"
  },
  "environment": {
    "compiler": "ocaml-5.5",
    "executor": "github-hosted",
    "pair_design": "period-balanced-v2",
    "platform": "linux-x86_64",
    "suite": "four-provider-v1",
    "suite_digest": "sha256:3a7c83b905f76bbcd58349e11ce8d57a017c4a82726209626c34881f6acda778"
  },
  "failures": [],
  "passed": true,
  "schema": "performance-comparison-v1",
  "threshold_percent": "10.000"
}
