{
  "baseline": {
    "digest": "sha256:3877591c78d39cfcc6653418a67f04634db93de31ac16df791d0c7a3c3f55441",
    "revision": "214163cde32456b9f137a94d5b870f7673977360"
  },
  "comparisons": [
    {
      "baseline_median_ns": "198447001/2",
      "change_percent": "0.383",
      "current_median_ns": "199206583/2",
      "explanation": null,
      "mode": "cold",
      "scenario": "arcade-scale-analysis",
      "status": "within-limit"
    },
    {
      "baseline_median_ns": "305710625/2",
      "change_percent": "-1.075",
      "current_median_ns": "151212354",
      "explanation": null,
      "mode": "incremental",
      "scenario": "arcade-scale-analysis",
      "status": "within-limit"
    },
    {
      "baseline_median_ns": "30587709",
      "change_percent": "0.015",
      "current_median_ns": "61184541/2",
      "explanation": null,
      "mode": "warm",
      "scenario": "arcade-scale-analysis",
      "status": "within-limit"
    },
    {
      "baseline_median_ns": "5275750",
      "change_percent": "0.153",
      "current_median_ns": "10567667/2",
      "explanation": null,
      "mode": "cold",
      "scenario": "four-provider-analysis",
      "status": "within-limit"
    },
    {
      "baseline_median_ns": "6469771",
      "change_percent": "-1.452",
      "current_median_ns": "6375834",
      "explanation": null,
      "mode": "incremental",
      "scenario": "four-provider-analysis",
      "status": "within-limit"
    },
    {
      "baseline_median_ns": "4154125",
      "change_percent": "3.622",
      "current_median_ns": "4304604",
      "explanation": null,
      "mode": "warm",
      "scenario": "four-provider-analysis",
      "status": "within-limit"
    }
  ],
  "current": {
    "digest": "sha256:e7f60e432ca92f3538945c4ff0767ea0f80cda6ba6ac9d80e2bf8d349e626414",
    "revision": "e1e47253d66fb34f8d9c9b5b18d8874f700f109c"
  },
  "environment": {
    "compiler": "ocaml-5.5",
    "executor": "github-hosted",
    "pair_design": "period-balanced-v2",
    "platform": "macos-arm64",
    "suite": "four-provider-v1",
    "suite_digest": "sha256:3a7c83b905f76bbcd58349e11ce8d57a017c4a82726209626c34881f6acda778"
  },
  "failures": [],
  "passed": true,
  "schema": "performance-comparison-v1",
  "threshold_percent": "10.000"
}
